{
  "schema_version": 1,
  "registry_version": 1,
  "bundle_digest": "aaaaaaaaaaaaaaaaaaaaaaaaaaaaaaaaaaaaaaaaaaaaaaaaaaaaaaaaaaaaaaaa",
  "governance_files": [
    {
      "path": "agent-selection-guide.md",
      "status": "active"
    },
    {
      "path": "protocol/principles-digest.md",
      "status": "active"
    },
    {
      "path": "protocol/playbooks/feature.md",
      "status": "active"
    },
    {
      "path": "protocol/playbooks/bug-fix.md",
      "status": "active"
    },
    {
      "path": "protocol/playbooks/refactoring.md",
      "status": "active"
    },
    {
      "path": "protocol/playbooks/perf.md",
      "status": "active"
    },
    {
      "path": "protocol/arena/arena-stage.md",
      "status": "active"
    },
    {
      "path": "protocol/arena/judge-brief.md",
      "status": "active"
    },
    {
      "path": "protocol/verification/template.md",
      "status": "active"
    },
    {
      "path": "protocol/autobuild/run-contract.md",
      "status": "inactive_in_v1",
      "decided_by": "#28"
    },
    {
      "path": "protocol/reflect/reviewer-brief.md",
      "status": "inactive_in_v1",
      "decided_by": "#29"
    },
    {
      "path": "protocol/writing/technical-writing.md",
      "status": "active"
    },
    {
      "path": "protocol/writing/unslop.md",
      "status": "active"
    }
  ],
  "carriers": {
    "author.brief": {
      "lifecycle": "required_for_v1",
      "required": [
        "agent-selection-guide.md",
        "protocol/principles-digest.md",
        "protocol/writing/technical-writing.md",
        "protocol/writing/unslop.md"
      ],
      "anchors": [
        "project_instructions"
      ],
      "forbidden": [
        "protocol/arena/judge-brief.md"
      ]
    },
    "author.core_flow": {
      "lifecycle": "required_for_v1",
      "required": [
        "agent-selection-guide.md",
        "protocol/principles-digest.md",
        "protocol/writing/technical-writing.md",
        "protocol/writing/unslop.md"
      ],
      "anchors": [
        "brief",
        "project_instructions"
      ],
      "forbidden": [
        "protocol/arena/judge-brief.md"
      ]
    },
    "author.tech_plan": {
      "lifecycle": "required_for_v1",
      "required": [
        "agent-selection-guide.md",
        "protocol/principles-digest.md",
        "protocol/writing/technical-writing.md",
        "protocol/writing/unslop.md"
      ],
      "anchors": [
        "core_flow",
        "project_instructions"
      ],
      "forbidden": [
        "protocol/arena/judge-brief.md"
      ]
    },
    "author.tickets": {
      "lifecycle": "required_for_v1",
      "required": [
        "agent-selection-guide.md",
        "protocol/principles-digest.md",
        "protocol/writing/technical-writing.md",
        "protocol/writing/unslop.md"
      ],
      "anchors": [
        "tech_plan",
        "project_instructions"
      ],
      "forbidden": [
        "protocol/arena/judge-brief.md"
      ]
    },
    "panel.opus": {
      "lifecycle": "required_for_v1",
      "required": [
        "agent-selection-guide.md",
        "protocol/principles-digest.md"
      ],
      "anchors": [
        "candidate",
        "acceptance_criteria"
      ],
      "forbidden": [
        "protocol/arena/judge-brief.md"
      ]
    },
    "panel.astra": {
      "lifecycle": "required_for_v1",
      "required": [
        "agent-selection-guide.md",
        "protocol/principles-digest.md"
      ],
      "anchors": [
        "candidate",
        "acceptance_criteria"
      ],
      "forbidden": [
        "protocol/arena/judge-brief.md"
      ]
    },
    "panel.grok": {
      "lifecycle": "required_for_v1",
      "required": [
        "agent-selection-guide.md",
        "protocol/principles-digest.md"
      ],
      "anchors": [
        "candidate",
        "acceptance_criteria"
      ],
      "forbidden": [
        "protocol/arena/judge-brief.md"
      ]
    },
    "panel.muse": {
      "lifecycle": "required_for_v1",
      "required": [
        "agent-selection-guide.md",
        "protocol/principles-digest.md"
      ],
      "anchors": [
        "candidate",
        "acceptance_criteria"
      ],
      "forbidden": [
        "protocol/arena/judge-brief.md"
      ]
    },
    "contest.reviewer": {
      "lifecycle": "required_for_v1",
      "required": [
        "agent-selection-guide.md",
        "protocol/principles-digest.md"
      ],
      "anchors": [
        "finding",
        "candidate"
      ],
      "forbidden": [
        "protocol/arena/judge-brief.md"
      ]
    },
    "narrow.reviewer": {
      "lifecycle": "required_for_v1",
      "required": [
        "agent-selection-guide.md",
        "protocol/principles-digest.md"
      ],
      "anchors": [
        "finding",
        "candidate"
      ],
      "forbidden": [
        "protocol/arena/judge-brief.md"
      ]
    },
    "implementer.feature": {
      "lifecycle": "required_for_v1",
      "required": [
        "agent-selection-guide.md",
        "protocol/principles-digest.md",
        "protocol/playbooks/feature.md"
      ],
      "anchors": [
        "ticket_manifest_entry",
        "acceptance_criteria",
        "project_instructions"
      ],
      "forbidden": [
        "protocol/arena/judge-brief.md"
      ]
    },
    "implementer.bug_fix": {
      "lifecycle": "required_for_v1",
      "required": [
        "agent-selection-guide.md",
        "protocol/principles-digest.md",
        "protocol/playbooks/bug-fix.md"
      ],
      "anchors": [
        "ticket_manifest_entry",
        "acceptance_criteria",
        "project_instructions"
      ],
      "forbidden": [
        "protocol/arena/judge-brief.md"
      ]
    },
    "implementer.refactoring": {
      "lifecycle": "required_for_v1",
      "required": [
        "agent-selection-guide.md",
        "protocol/principles-digest.md",
        "protocol/playbooks/refactoring.md"
      ],
      "anchors": [
        "ticket_manifest_entry",
        "acceptance_criteria",
        "project_instructions"
      ],
      "forbidden": [
        "protocol/arena/judge-brief.md"
      ]
    },
    "implementer.perf": {
      "lifecycle": "required_for_v1",
      "required": [
        "agent-selection-guide.md",
        "protocol/principles-digest.md",
        "protocol/playbooks/perf.md"
      ],
      "anchors": [
        "ticket_manifest_entry",
        "acceptance_criteria",
        "project_instructions"
      ],
      "forbidden": [
        "protocol/arena/judge-brief.md"
      ]
    },
    "verifier.deterministic": {
      "lifecycle": "required_for_v1",
      "required": [
        "agent-selection-guide.md",
        "protocol/principles-digest.md",
        "protocol/verification/template.md"
      ],
      "anchors": [
        "candidate",
        "acceptance_criteria"
      ],
      "forbidden": [
        "protocol/arena/judge-brief.md"
      ]
    },
    "verifier.model_assisted": {
      "lifecycle": "required_for_v1",
      "required": [
        "agent-selection-guide.md",
        "protocol/principles-digest.md",
        "protocol/verification/template.md"
      ],
      "anchors": [
        "candidate",
        "acceptance_criteria"
      ],
      "forbidden": [
        "protocol/arena/judge-brief.md"
      ]
    },
    "reviewer.code": {
      "lifecycle": "required_for_v1",
      "required": [
        "agent-selection-guide.md",
        "protocol/principles-digest.md"
      ],
      "anchors": [
        "candidate",
        "acceptance_criteria"
      ],
      "forbidden": [
        "protocol/arena/judge-brief.md"
      ]
    },
    "arena.candidate": {
      "lifecycle": "required_for_v1",
      "required": [
        "agent-selection-guide.md",
        "protocol/principles-digest.md",
        "protocol/arena/arena-stage.md",
        "protocol/playbooks/feature.md"
      ],
      "anchors": [
        "ticket_manifest_entry",
        "acceptance_criteria"
      ],
      "forbidden": [
        "protocol/arena/judge-brief.md"
      ]
    },
    "arena.judge": {
      "lifecycle": "required_for_v1",
      "required": [
        "agent-selection-guide.md",
        "protocol/principles-digest.md",
        "protocol/arena/judge-brief.md"
      ],
      "anchors": [
        "candidate",
        "acceptance_criteria"
      ],
      "forbidden": []
    },
    "arena.final_implementer": {
      "lifecycle": "required_for_v1",
      "required": [
        "agent-selection-guide.md",
        "protocol/principles-digest.md",
        "protocol/arena/arena-stage.md",
        "protocol/playbooks/feature.md"
      ],
      "anchors": [
        "ticket_manifest_entry",
        "acceptance_criteria"
      ],
      "forbidden": [
        "protocol/arena/judge-brief.md"
      ]
    },
    "autobuild.generator": {
      "lifecycle": "planned_after_v1",
      "decided_by": "#28",
      "required": [
        "agent-selection-guide.md",
        "protocol/principles-digest.md",
        "protocol/autobuild/run-contract.md"
      ],
      "anchors": [
        "acceptance_criteria"
      ],
      "forbidden": [
        "protocol/arena/judge-brief.md"
      ]
    },
    "autobuild.evaluator": {
      "lifecycle": "planned_after_v1",
      "decided_by": "#28",
      "required": [
        "agent-selection-guide.md",
        "protocol/principles-digest.md",
        "protocol/autobuild/run-contract.md",
        "protocol/verification/template.md"
      ],
      "anchors": [
        "candidate",
        "acceptance_criteria"
      ],
      "forbidden": [
        "protocol/arena/judge-brief.md"
      ]
    },
    "reflect.reviewer": {
      "lifecycle": "planned_after_v1",
      "decided_by": "#29",
      "required": [
        "agent-selection-guide.md",
        "protocol/principles-digest.md",
        "protocol/reflect/reviewer-brief.md"
      ],
      "anchors": [
        "candidate"
      ],
      "forbidden": [
        "protocol/arena/judge-brief.md"
      ]
    },
    "debate.participant": {